Name,Description,Latitude,Longitude,InfoURL,ImageURL,
UCSB,A great university located along the California coast!,34.416929,-1.20E+02,"https://en.wikipedia.org/wiki/University_of_California,_Santa_Barbara",https://web.physics.ucsb.edu/~Women/images/ucsb-big.jpg,https://www.google.com/search?q=uc+santa+barbara+physics&rlz=1C1GGRV_enUS757US757&source=lnms&tbm=isch&sa=X&ved=2ahUKEwj2x_7hoaX0AhWXFjQIHWZMBagQ_AUoAXoECAEQAw&biw=1680&bih=907&dpr=1#imgrc=zaLllhEegiO6CM
Boston,"Boston is the capital and largest city of Massachusetts and the largest city in New England in the northeast of the United States. Boston is located on the Atlantic coast in the northeast of the United States. Founded in 1630, it is one of the oldest and most culturally valuable cities in the United States. The Boston Tea dumping incident in American history finally led to the famous American War of independence.",42.3601,-71.0589,https://en.wikipedia.org/wiki/Boston,https://static.onecms.io/wp-content/uploads/sites/28/2021/02/23/boston-massachusetts-BOSTONTG0221.jpg,
Los Angeles,"Los Angeles, located in the southwest of California, is the second largest city in the United States and the largest city in the western United States. It is often called ""City of Angels"".",34.0522,-118.2437,https://en.wikipedia.org/wiki/Los_Angeles,https://upload.wikimedia.org/wikipedia/commons/thumb/6/69/Los_Angeles_with_Mount_Baldy.jpg/2560px-Los_Angeles_with_Mount_Baldy.jpg,
"Cheyenne, Wyoming","Cheyenne is the capital and largest city of Wyoming, the largest city in the state and the county seat of Laramie county.",41.14,-104.8202,"https://en.wikipedia.org/wiki/Cheyenne,_Wyoming",https://upload.wikimedia.org/wikipedia/commons/5/53/CheyenneWyoming_%28cropped%29.jpg,
Suzhou,"Suzhou is one of the first batch of national famous historical and cultural cities with a history of nearly 2500 years. It is an important birthplace of Wu culture and has the reputation of ""paradise on earth"". Suzhou classical gardens and China Grand Canal (Suzhou section), representatives of Chinese private gardens, are listed as world cultural heritage by UNESCO.",31.299,120.5853,https://en.wikipedia.org/wiki/Suzhou,"https://gimg2.baidu.com/image_search/src=http%3A%2F%2F5b0988e595225.cdn.sohucs.com%2Fimages%2F20191004%2F64bda5df151f45f58b3546ea1a92d71c.jpeg&refer=http%3A%2F%2F5b0988e595225.cdn.sohucs.com&app=2002&size=f9999,10000&q=a80&n=0&g=0n&fmt=jpeg?sec=1640759925&t=1a1c3c6d19daac28beb9c2d607a54b9e",
"Augusta, Maine","Augusta is a city located in kennabek County, Maine. It was built in 1621 and became the state capital in 1831. It is also the capital of Maine and the county seat of kennabek county. Nearby are typical New England landscapes, forested hills and beautiful glacial lakes. Summer resort.",44.3106,-69.7795,"https://en.wikipedia.org/wiki/Augusta,_Maine",https://upload.wikimedia.org/wikipedia/commons/9/92/Augusta%2C_Maine_2.jpg,
